{
  "$schema": "./config.schema.json",
  "hideDeniedTools": true,
  "bashSafety": {
    "customEnvironment": "ask",
    "pty": "ask",
    "commands": {
      "find": [
        {
          "policy": "ask",
          "reason": "find can write result data or delete matching paths",
          "arguments": [
            "-delete",
            "-fprint",
            "-fprint0",
            "-fprintf",
            "-fls"
          ]
        },
        {
          "policy": "ask",
          "reason": "find can execute commands for matching paths",
          "arguments": [
            "-exec",
            "-execdir",
            "-ok",
            "-okdir"
          ]
        },
        {
          "policy": "ask",
          "reason": "find can follow symbolic links",
          "arguments": [
            "-follow"
          ],
          "shortFlags": [
            "L"
          ]
        }
      ],
      "fd": [
        {
          "policy": "ask",
          "reason": "fd can execute commands for search results",
          "arguments": [
            "--exec",
            "--exec-batch"
          ],
          "argumentPrefixes": [
            "--exec=",
            "--exec-batch="
          ],
          "shortFlags": [
            "x",
            "X"
          ]
        },
        {
          "policy": "ask",
          "reason": "fd can include hidden paths",
          "arguments": [
            "--hidden"
          ],
          "shortFlags": [
            "H"
          ]
        },
        {
          "policy": "ask",
          "reason": "fd can follow symbolic links",
          "arguments": [
            "--follow"
          ],
          "shortFlags": [
            "L"
          ]
        }
      ],
      "rg": [
        {
          "policy": "ask",
          "reason": "ripgrep can preprocess files with an external command",
          "arguments": [
            "--pre",
            "--pre-glob"
          ],
          "argumentPrefixes": [
            "--pre=",
            "--pre-glob="
          ]
        },
        {
          "policy": "ask",
          "reason": "ripgrep can search compressed archives",
          "arguments": [
            "--search-zip"
          ],
          "shortFlags": [
            "z"
          ]
        },
        {
          "policy": "ask",
          "reason": "ripgrep can include hidden paths",
          "arguments": [
            "--hidden"
          ],
          "shortFlags": [
            "."
          ]
        },
        {
          "policy": "ask",
          "reason": "ripgrep can bypass ignore-file boundaries",
          "arguments": [
            "--no-ignore"
          ],
          "argumentPrefixes": [
            "--no-ignore-"
          ]
        },
        {
          "policy": "ask",
          "reason": "ripgrep can follow symbolic links",
          "arguments": [
            "--follow"
          ],
          "shortFlags": [
            "L"
          ]
        }
      ],
      "grep": [
        {
          "policy": "ask",
          "reason": "grep can recursively traverse directories",
          "arguments": [
            "--recursive",
            "--dereference-recursive"
          ],
          "shortFlags": [
            "r",
            "R"
          ]
        }
      ],
      "ag": [
        {
          "policy": "ask",
          "reason": "the silver searcher can include hidden or ignored paths",
          "arguments": [
            "--hidden",
            "--unrestricted"
          ],
          "shortFlags": [
            "u"
          ]
        },
        {
          "policy": "ask",
          "reason": "the silver searcher can follow symbolic links",
          "arguments": [
            "--follow"
          ],
          "shortFlags": [
            "f"
          ]
        },
        {
          "policy": "ask",
          "reason": "the silver searcher can execute an external pager",
          "arguments": [
            "--pager"
          ],
          "argumentPrefixes": [
            "--pager="
          ]
        }
      ],
      "ack": [
        {
          "policy": "ask",
          "reason": "ack can execute an external pager",
          "arguments": [
            "--pager"
          ],
          "argumentPrefixes": [
            "--pager="
          ]
        }
      ],
      "file": [
        {
          "policy": "ask",
          "reason": "file can compile a magic database",
          "arguments": [
            "--compile"
          ],
          "shortFlags": [
            "C"
          ]
        }
      ],
      "less": [
        {
          "policy": "ask",
          "reason": "less can write its input to a log file",
          "arguments": [
            "--log-file"
          ],
          "argumentPrefixes": [
            "--log-file="
          ],
          "shortFlags": [
            "o",
            "O"
          ]
        }
      ],
      "tree": [
        {
          "policy": "ask",
          "reason": "tree can write output or follow symbolic links",
          "arguments": [
            "--output"
          ],
          "argumentPrefixes": [
            "--output="
          ],
          "shortFlags": [
            "o",
            "l"
          ]
        }
      ],
      "git": [
        {
          "policy": "ask",
          "reason": "git diff, log, and show can write output or invoke external diff helpers",
          "subcommands": [
            "diff",
            "log",
            "show"
          ],
          "arguments": [
            "--output",
            "--ext-diff",
            "--textconv"
          ],
          "argumentPrefixes": [
            "--output="
          ]
        },
        {
          "policy": "ask",
          "reason": "git branch options can mutate branch refs or tracking configuration",
          "subcommands": [
            "branch"
          ],
          "arguments": [
            "--delete",
            "--move",
            "--copy",
            "--force",
            "--track",
            "--no-track",
            "--set-upstream-to",
            "--unset-upstream",
            "--edit-description",
            "--create-reflog"
          ],
          "argumentPrefixes": [
            "--set-upstream-to="
          ],
          "shortFlags": [
            "d",
            "D",
            "m",
            "M",
            "c",
            "C",
            "f",
            "t",
            "u"
          ]
        },
        {
          "policy": "ask",
          "reason": "git tag options can create, replace, sign, or delete tags",
          "subcommands": [
            "tag"
          ],
          "arguments": [
            "--delete",
            "--force",
            "--annotate",
            "--sign",
            "--local-user",
            "--message",
            "--file",
            "--edit",
            "--create-reflog",
            "--cleanup"
          ],
          "argumentPrefixes": [
            "--local-user=",
            "--message=",
            "--file=",
            "--cleanup="
          ],
          "shortFlags": [
            "d",
            "f",
            "a",
            "s",
            "u",
            "m",
            "F",
            "e"
          ]
        }
      ],
      "curl": [
        {
          "policy": "ask",
          "reason": "curl can write files, upload data, change the request, load configuration, or read credentials",
          "arguments": [
            "--output",
            "--remote-name",
            "--remote-name-all",
            "--output-dir",
            "--dump-header",
            "--cookie-jar",
            "--etag-save",
            "--trace",
            "--trace-ascii",
            "--trace-config",
            "--stderr",
            "--libcurl",
            "--upload-file",
            "--request",
            "--data",
            "--data-ascii",
            "--data-binary",
            "--data-raw",
            "--data-urlencode",
            "--form",
            "--form-string",
            "--json",
            "--config",
            "--next",
            "--no-head",
            "--get",
            "--continue-at",
            "--remote-time",
            "--remote-header-name",
            "--cookie",
            "--header",
            "--user",
            "--netrc",
            "--netrc-file",
            "--netrc-optional",
            "--key",
            "--cert",
            "--proxy-key",
            "--proxy-cert",
            "--write-out"
          ],
          "argumentPrefixes": [
            "--output=",
            "--remote-name=",
            "--remote-name-all=",
            "--output-dir=",
            "--dump-header=",
            "--cookie-jar=",
            "--etag-save=",
            "--trace=",
            "--trace-ascii=",
            "--trace-config=",
            "--stderr=",
            "--libcurl=",
            "--upload-file=",
            "--request=",
            "--data=",
            "--data-ascii=",
            "--data-binary=",
            "--data-raw=",
            "--data-urlencode=",
            "--form=",
            "--form-string=",
            "--json=",
            "--config=",
            "--continue-at=",
            "--cookie=",
            "--header=",
            "--user=",
            "--netrc-file=",
            "--key=",
            "--cert=",
            "--proxy-key=",
            "--proxy-cert=",
            "--write-out="
          ],
          "shortFlags": [
            "o",
            "O",
            "D",
            "c",
            "T",
            "d",
            "F",
            "X",
            "G",
            "K",
            "C",
            "R",
            "J",
            "b",
            "H",
            "u",
            "E",
            "w"
          ]
        }
      ],
      "sort": [
        {
          "policy": "ask",
          "reason": "sort can write output to a file",
          "arguments": [
            "--output"
          ],